{
  "slug": "three-legged-downward-dog",
  "name": "Three-Legged Downward Dog",
  "sanskritName": "Eka Pada Adho Mukha Svanasana",
  "otherNames": ["Downward Dog Split"],
  "musclesInvolved": ["shoulders", "hamstrings", "glutes", "core"],
  "series": [],
  "durationSeconds": 20,
  "assists": [],
  "image": "image.jpeg",
  "verified": false,
  "notes": "Draft entry from seed photo import; review and correct before use in a real class."
}
