{
  "slug": "downward-facing-dog",
  "name": "Downward-Facing Dog",
  "sanskritName": "Adho Mukha Svanasana",
  "otherNames": [],
  "musclesInvolved": ["shoulders", "hamstrings", "calves", "core"],
  "series": [],
  "durationSeconds": 30,
  "assists": [],
  "image": "image.jpeg",
  "verified": false,
  "notes": "Draft entry from seed photo import; review and correct before use in a real class."
}
